{"config_schema_version":"1.0","correction_reason":"E1.1 prerequisites re-derived from clean Git, probe source hash and code-controlled MERT registry","dataset_id":"dataset_2f20a12d8dc5913cdd20d836fa33aa37bac349cf69117b8141595413ebe97d29","e0_implementation_status":"COMPLETE","e1_1_blocked_reasons":["E1_1_PREREQUISITE_NOT_VALID:MERT_UPSTREAM_IDENTITY","MERT_LOCAL_ROLE_NOT_VERIFIED:config","MERT_LOCAL_ROLE_NOT_VERIFIED:processor","MERT_LOCAL_ROLE_NOT_VERIFIED:weights","MERT_FORMAL_BINDING_FAILED"],"e1_1_blocked_roles":["config","processor","weights"],"e1_1_prerequisite_validity":{"E0_MINIMUM_BOOTSTRAP":"VALID","MERT_PROBE_IDENTITY":"VALID","MERT_PROBE_REPRESENTATION":"VALID","MERT_UPSTREAM_IDENTITY":"NOT_VALID"},"e1_1_readiness":"BLOCKED","formal_execution_ready":false,"full_catalog_blocker":"IMPLEMENTATION_BLOCKED_BY_FROZEN_CONTRACT: SGA-M0M20-EV-3R+","full_catalog_blocker_deferred":true,"implementation_git_commit":"0b3891d7f9d824e1f1575d8d1f4af345c70207de","mert_local_verification_status":"EXPECTED_CHECKSUMS_UNREGISTERED","mert_repository":"m-a-p/MERT-v1-95M","mert_revision":"12af15fef9d0ac838c3f475bfbbf26d2060dd4f5","mert_upstream_identity":"3424da209d14f426e35e65929f8e9d3462738bf7793af199059635437c586703","observed_git_dirty":false,"paper_eligible":false,"probe_manifest_id":"sample_bceeabb92e455714f1dd8c81efee768bd27abff4b9207fb68d4e3d069a23aab8","probe_manifest_sha256":"8e61379f7c0e0520a68b47a517cbc4ea576efb2b5182fa6b2559c28ff94bd755","probe_preparation_status":"SPECIFIED_NOT_EXECUTED","probe_seconds":45,"qualification_sha256":"6f1bea9f108a5f8ba0a3f00986e464a61a9f6a46fe772fce7ba6f90d9574ecdf","research_spec_version":"1.0","resolved_config_hash":"c120eb752e757ba68852bbf52201aff7a694bb7443def0e99611b15d8ef4e6e3","sample_id":"sample_bceeabb92e455714f1dd8c81efee768bd27abff4b9207fb68d4e3d069a23aab8","schema_version":"1.0","semantic_config_hash":"3aaf470ccfbc573ba16882020abac49114680935d79fe2006fe67853a0321bc6","song_id":"song_a73cfb75df81c197e9e11e58bc0832df0811e0d3158529af04cffb3f0a136f1d","source_relative_path":"DEAM_audio/MEMD_audio/2.mp3","source_sha256":"e63489839b957bbd5a6d8b073bacdcb64b7a6b2883802c10c8148a93219dce7b","stage_authority_coverage":["E0_MINIMUM_BOOTSTRAP","E1_1_MERT_REAL_OUTPUT_FRAME_RATE_PRINT"],"stages_catalog_sha256":"4c97f845b66bbf004f1ff14ca1a4be632ffa23743028f77e08962fb404d003f2","supersedes":"evidence/qualifications/step-0-minimum-bootstrap-v2.json","target_sample_count":1080000,"target_sample_rate_hz":24000,"variants_catalog_sha256":"96cccb5ddc610c8e717d6a4b90c33e18270a5419fdfabeaddf0c5b826d34b0be"}
